{
  "color": "DEFAULT",
  "isTrashed": false,
  "isPinned": false,
  "isArchived": false,
  "annotations": [
    {
      "description": "",
      "source": "WEBLINK",
      "title": "Example Website",
      "url": "https://example.com"
    },
    {
      "description": "",
      "source": "WEBLINK",
      "title": "Wikipedia - Sample Article",
      "url": "https://en.wikipedia.org/wiki/Sample_article"
    },
    {
      "description": "",
      "source": "WEBLINK",
      "title": "GitHub - Sample Repository",
      "url": "https://github.com/example/sample-repo"
    },
    {
      "description": "",
      "source": "WEBLINK",
      "title": "Stack Overflow - Sample Question",
      "url": "https://stackoverflow.com/questions/12345/sample-question"
    },
    {
      "description": "",
      "source": "WEBLINK",
      "title": "MDN Web Docs - Sample Documentation",
      "url": "https://developer.mozilla.org/en-US/docs/Web/Sample"
    },
    {
      "description": "Sample website for demonstration purposes.",
      "source": "WEBLINK",
      "title": "Sample Website - Demo Page",
      "url": "https://httpbin.org"
    }
  ],
  "textContent": "https://httpbin.org\n\nhttps://en.wikipedia.org/wiki/Sample_article\n\nhttps://github.com/example/sample-repo\n\nhttps://stackoverflow.com/questions/12345/sample-question\n\nhttps://developer.mozilla.org/en-US/docs/Web/Sample",
  "title": "Sample Links Collection",
  "userEditedTimestampUsec": 1601221667352000,
  "createdTimestampUsec": 1600022817449000,
  "textContentHtml": "<p dir=\"ltr\" style=\"line-height:1.38;margin-top:0.0pt;margin-bottom:0.0pt;\"><span style=\"font-size:7.2pt;font-family:'Google Sans';color:#000000;background-color:transparent;font-weight:400;font-style:normal;font-variant:normal;text-decoration:none;vertical-align:baseline;white-space:pre;white-space:pre-wrap;\">https://httpbin.org<\/span><\/p><br /><p dir=\"ltr\" style=\"line-height:1.38;margin-top:0.0pt;margin-bottom:0.0pt;\"><span style=\"font-size:7.2pt;font-family:'Google Sans';color:#000000;background-color:transparent;font-weight:400;font-style:normal;font-variant:normal;text-decoration:none;vertical-align:baseline;white-space:pre;white-space:pre-wrap;\">https://en.wikipedia.org/wiki/Sample_article<\/span><\/p><br /><p dir=\"ltr\" style=\"line-height:1.38;margin-top:0.0pt;margin-bottom:0.0pt;\"><span style=\"font-size:7.2pt;font-family:'Google Sans';color:#000000;background-color:transparent;font-weight:400;font-style:normal;font-variant:normal;text-decoration:none;vertical-align:baseline;white-space:pre;white-space:pre-wrap;\">https://github.com/example/sample-repo<\/span><\/p><br /><p dir=\"ltr\" style=\"line-height:1.38;margin-top:0.0pt;margin-bottom:0.0pt;\"><span style=\"font-size:7.2pt;font-family:'Google Sans';color:#000000;background-color:transparent;font-weight:400;font-style:normal;font-variant:normal;text-decoration:none;vertical-align:baseline;white-space:pre;white-space:pre-wrap;\">https://stackoverflow.com/questions/12345/sample-question<\/span><\/p><br /><p dir=\"ltr\" style=\"line-height:1.38;margin-top:0.0pt;margin-bottom:0.0pt;\"><span style=\"font-size:7.2pt;font-family:'Google Sans';color:#000000;background-color:transparent;font-weight:400;font-style:normal;font-variant:normal;text-decoration:none;vertical-align:baseline;white-space:pre;white-space:pre-wrap;\">https://developer.mozilla.org/en-US/docs/Web/Sample<\/span><\/p>"
}