{
  "attachments": [
    {
      "filePath": "sample_image_12345.png",
      "mimetype": "image/png"
    }
  ],
  "color": "DEFAULT",
  "isTrashed": false,
  "isPinned": false,
  "isArchived": false,
  "textContent": "",
  "title": "Sample AI Chatbot Conversation",
  "userEditedTimestampUsec": 1660842519191000,
  "createdTimestampUsec": 1660842497197000
}